{"actionable":false,"adapter_sha256":"4925FDA816CDC529A70E850850C898033C2C593DCDF2940803C0815B63B9B508","adapter_version":"P1008_T1_DERIVED_KPI_ADAPTER_V1","candidate_id":"WR-T1-609C61B6D6F3E57C-4925FDA816CD","candidate_owner":"WAR_ROOM","candidate_schema_version":"P1008_T1_WAR_ROOM_CANDIDATE_V1","candidate_sha256":"22A0FD5097CF67FAEFEB3870994C270E3A6D4DF57DF13DCBB98E7F5FAA82089E","created_at":"2026-09-27T00:00:00Z","formal_authority":false,"manifest_id":"T1BM-22A0FD5097CF67FA","owner_review_required":true,"production_scoring_enabled":false,"publication":false,"schema_version":"P1008_T1_BRIDGE_MANIFEST_V1","source_candidate_id":"TEST-ONLY-PB-2026-09-18-V1","source_candidate_sha256":"609C61B6D6F3E57CA80925626C1CA09C096B0CC7F0E93F416DE9DD0FD28EBFAF","source_contract":"P1008_DERIVED_KPI_CANDIDATE_V1","synthetic_fixture":true,"validation_receipt_id":"T1VR-609C61B6D6F3E57C-4925FDA816CD","validation_receipt_schema_version":"P1008_T1_VALIDATION_RECEIPT_V1","validation_receipt_sha256":"B2BE30CF76310DDC56031E35A17AE68D9398F9919F43380A192A6BB5EDAEB77D"}
